{
  "format": "imani-lot-disclosure/1",
  "lotId": "LOT-01",
  "network": "test",
  "closeHeight": 4200100,
  "ufvk": "uviewtest17w56pknztuy6w5swf0d588kltkydtt78qy89hwyzhv89rgjhnzfc0y25np6waaz93dfjvus7frg488lnahx902mxdcv0hy7s0phyvn0aphr7alw8znwy7jxqs526zugsxs07fjdflxf98jgsdqrxx2tueen2a06w238qymdnz7euszng7r2c9ps5c0fsen6vtuevd3xraty4grdmal8kuag3z50fk5acsg2jhvg6qrrjykgqnfu2twnmhpd42adhvuf7hpvlz7r6gglvfumhru4wntl9ej4t5c7hm47umyxjzale4axlkv8t7kqqlr8h29jslygwnauu5vmdspj7ye6fufgwnljj4aeq304qzlr79wnpk9xz6rak2ln695ttc0j70yz6xdz2re4h25ggx3lywu9m6v0afp2u37mudupwr2u3278c4v934tfk59y7mjgrlcudjcwkn9pru3z07km6aexanaevqyuyluzfck2x84p4sq4a9tm3",
  "rules": {
    "kind": "goal",
    "goalZat": 2000000
  },
  "transactions": [
    {
      "txid": "e0656c882730bbc466afa80f0cd07c0caa8a5c2dc74132190c16ff965d8d426c",
      "height": 4200030,
      "txHex": "0600008098b684d85b16a537000000008616400001e0c333b6cb2d3f8435f7e812123010d06edc5cf4cdb6186f175c3aa3d8a0fd7b000000006b483045022100aaebe5d765fa145f3472d950120614063f1742d185426e12eeaf386ec9b5ad1102207f80e762dd3bc5dad6c16ae2b404f0d9c4271e867c6bf64adcf8c5ffa71f6b860121024a12f201fd0ab328361dbdc1a46a8c353e6839958e550d904ce5126698776aafffffffff0000000002b97babb77fa1b458a2626cdb6a7b2f15aa77afb5ce17fbc8a40669738078a3027b1708e2b4852958c526d729c36ea2d0ee1e1911aad1057bb5c95c1a7d9fbc3350f597619d7958c907217afe376e351b728ec26f6464aeb5ac811a8a09c96a85d65ed467bc990b5514b0155e79da3050ae709482793b5cece78bd04737bc04158194547f9075ef07569fe7ad6e690e673bddc849d9a78cb0fb020ca5b4049018aa47c41019bdf5b01074ca18088a5595f9f7dd73590162d08ec12bd40653239504d73f7c4350b46d4509b69e9f978ce56acac96ea0bbec8efd4656f52d4d1d752377f10e3accb9692db80ba4461af3ee52e9b4c5e3487a8220eed2cd842fc10d08b4594e83d479a90feaf512a2175ff07056beebd1e19d1a5efa8b3614a28ed8dddf75de9cd41a924efcf6901d4c1633e59d6fa8e84534465d893abe26fe1dacccc6872a716d61af580953ee339cd1bc6c3c86ba1dbedd70eb6bd15a72323c15ce1288862db78a5a2e43bf2e22aa993d5f386d5068a27b59da7e9d91614095945bd9488a7f3a19c18d3237eaa96acdfc1289d8b86a3a68b9c6da3b729f110d90e188ed519aab066f893d5951ead4daff54ffcc6804a7df8d6c07e8c42ed1d157722d83b8a434bbc6eaad06bbbbabd7b2bfa9699898e4814bf63beffccf0f324a9d2b753c2d0cfff0ecc504db7d64697093fae1ce07cef6f3b820be26a5df6106bd84a545ccf215ee4cf22334b244d80e795480f4244d2df8b75214ef8f3a863f9c3a7eb4541b52f472fa992c9b2b8a23a57c2e09bf3e8e9968596a6585924b78d567d6768e30b3eba86f80f721edb1b87bf0b82b3063a6f49618feaeff344d006eb0a9f387529a079b02878ada59e7213ce95becc906dc6db06163a663ff0e8850d53685bf356d8df62e38bf0a8d79db55d693f1ae9cc8b7a3b6b2ff8ef1c683841958942bb19c77b7e13f61edcf1b6a7b8224cef59b52fe251780e77631e08bf8dcdac24a3747a357fbe1784bff3cbaff3ab596548390e700fedd70d306c3d0feed1a6cde5f4ca59183c85764017896a5f5d0323678a1c41231496fb865148fe4cc97bf99e22ab4cc41e4bd53da1af73c30d6cb0cadb7beee4d45c5ea218482752d0652efa1b391c4131748e130cb590dc2eb2935d55b98dec6ceae1af3f93d2a6c03036b11c9bfebd234d9c752875e5931b3be7cb4dfb07f5c7a4bceffa1c2af09894e75c72d591aeb508f027e50787aafb918a8e35f6ca6fb33a0d5141d034bad7ddc33843e1c48a42ab18f93d5232e2d7b28ad137b36bbf873893ca01339f8b6bf1c741a4c79e77f26b093371018fe5bca0f4a132775975e9718d191967177659ecc31206bb030730ec1073a2a7d2aa521280212a1fd267d0ff861a3eb3921078c6d9b2f3834451b5432b29db54f8b305f48a355aefc3f8714bd7804d34755f6b54a576e1672939c7bb5cfaf8e9a5d1064ee05ed84be4dc2ab96c38b30a994d1579903de87332341b520ba533ad57c90146b500ebe42a1205bd4685edf108bb42329170986eaa692b986970239bc7a1e91fd0cb7b2fff390c94a1ad193046b18f1a6bfaf014a5a92827f4dd3575cdf3fa52b33ae0ba1b15162063dc83258bd973c25048144b3bedf4eaeee32efdde1d6a4875a3f847c3dac38faf30f80f889b7c43077ea2f96462815600d1db0756a7a6c99cd4165963cba6238d62aea660aa37c90ac051b8cd62063be7020fb884b9816bcb10a4a32b56c0c1c89aaf63cd14ce1703388500057046c76c8280516b1c4b71093fa4d5bf92a1b7521a3005f405e4fbfdf1f355b2fe477acb7463fce1f1dccef9743f56b0699b8d9172e665125b1211a00f8a31280e1fa14a075287a9b62d77d5d105479ad4d50b62335e25e814da4a24d7e37f9d3b90e8d42ebdfe256b59e15bea73691cf42b56eb03555b20bbecd9ecf5719bac530991bbdaf5436deaa55e47a570162676e3bca5d25187adec6ffa1639e565a1075b916ac3f74bfc2cae467ca68f36bb60f8b8bcc5f5a0ec10d5a7315def697dbc772ede0835c9abdccd8f57c43bc9b09d2f7b4de1b8ef19c29775512fee011c1da6eba9c90c3da08e2cfbf0d932ba97e5fe148c0389fe77dead44e1f37be226f89e8c2440a6197416dad3069cbe3e8cad43fc092917055737b6ff041a626214aa6e9e320ec3635d36dfd33e17c0c52b4987df6f89a6ed97fd42e296a9f2fe39b2ef3138e170de71e06620e324b31b64d718522feba606c5a649924d25ff12df3bd1f0445ae9ee4aa8ced964065de3f3a576771690ad2d790a876de496cfce507a01ce9ffffffffffae2935f1dfd8a24aed7c70df7de3a668eb7a49b1319880dde2bbd9031ae5d82ffd601cff8725c5e14508309ac8f7622543482de50dd6134301319baa56dd13c762729cc9a69c08b6e695424381280c4057fd677d0751d407ea0b782c4451f6d2509a066d80b581273ccec74288ac3f9c0a8402c54400d86ce389e568174e2b1bc5c228b85c16c6bf4030784618ab965d09a7b0b78ecb774b5456ac6df5091917319b8881729ee97f13f2ab5b782e42f053e1c748d62a22ea889c172fef3265c5cde382a7e4e951f09e391f6234df9e4195e426f174f4ce37031f72339e88e47d8d9d80e51cf01596ab07e17b1775556c009c54cc19630ca2cf2b7f39791ebf5ce9bf05829fb1bc398142839680bce7537772c115a542c0d4962cb14c47f1be00af92b1d0a9d77dba1b41b6fab62318d7934caff44b1f840bc9236a540c39b8e38e751413e745bbe2fd2cbc879012a5311e1c901f1f0553b1cc42733cbc0058f60c602c941558393a83a2e0472a16bfe8536da3737b2a850e27c1c2c29cd7bb48da5120fb547b927e54396d131b5c8960ba1f092d8c895d82f585d12deff0981846abb8ea062495bf352e8d3e12580a36fba074826dbb005b73c33cc9fd0486a61b410940d25575e4d55d4553186e862a0a909fc22543bfdbc895ad48ccb031d7d5a91ad06f74a8eef55d787bfa11cdb6707400ee07eacaa891bd203a68a4477f317a2f45cb6d02430f8ecebc5d5ea15740cbecf3a0f7747f16cba6678f8f3c4694ef09f4764b8c0169a25d5a7b9d5908263b72852e2bd8e486e1d27b2d69e3f845280653fe69fcd3d8927f377f9653cee238a6e816737d078439c03615341ac5681aad9a667934d24309f563618d0513660068145785c98287ee7b1d69080ddc98b585cac711c00cbb6b709b1eaae109c2af8ffc4e4edfa77e5946d24ee1d3829f150d353672413d0f16765aeb398672aed12870e862547bf5a68cac13bbd86c2fc1902ddeca950c05f402bd0d9dd4443a5772a418e2fef9aafbb11b06a18338e392399a692eedf04aa6c53a7c4ee22872d05020772274a30f04b995a046c92691803343feb6970163bd473822aca2d8d74a525a82435448e1465eaabb21ef7f24a21a6f5147ba55218c4cacfda2f1ee843eb1f4a62f4c6e91407950dae7375710539a25fcfb0987b8df3eefe6027f64a14e328bb0a148f51dbb02c183fafc6fa7cc3563ee5201776a7880fa399a5a39c4e0244c560d2d06f2c8d13b66f404d077a9b81a20db16b7da1919a83f02c3fb6abf533e89ce21ed0fd5d038bc78f4b69651b0bab595b8b7d8f33a4c65de1da279c6a595f73d7387923f0acbc4d362122aaf2687678f3c464d560f15569c8c0c3d56099c12c1b9eb6167c081604abd6d039981c294e347c43729bd680a4f4699ac8404999c5d607f4fe5f918330a0adc915629c4662a180e1cb593500a66f31c65faf40d2e2842edc9a0623bdf1ad7195b9ab241ddff62c42e602273f857ff5f88f407a3def481bd30a018be68b64518774cb6d78acd46efd009d9dd88bb650826d445df164e442f8094c27716a24b6ff09584eaca9472c2144307b36ac296d672e548711d6a69c4373866e6dea6c3c26a672a9e76efe5f8858e0d30e6f05097e1ffaac8e57f426548312b3b8cd05bd481c202dfe2e82b3f12820ba5193fb178c35c5267b9bcd9c3bdc28f70fbb34ca96fc082574ea3ccecee8c336343bdac856d53e206c70e96d941edbabadbdcc3ba0a12b6ca5f4b0e6221f8a1e90b0d758a426e33d15e74cca33e510591919470831d3a3d51ba0c6b1433221337f2c672b2de96d9dbc07ee4fa78e49a83836afe619b680232cf8747a2b910c1e94130d7ea47cfb433aba9ed0484474e7587a43c734cf3897213d347d99701d63f92f9f83d5e5ce4b0b0f33b95cb3fe07e0491d2d47dc5ba5013fbbaab69381dcf3649c6c02295ae06a66c76ae2b9c709f5e5153e9d7dd2217e7a2d3b5df8f6d546e10fa81601d7329abeb1b823a3296ade7add8364c75a8fd769555d1031e507da46266f38cfe8a40021a609377ab1a90caee2e613534178f06c512b46132059436e4deb69537f24ebb4d25d2521996e6a0d0a3288aae041c4ddf9b8ce8623efea5833b26fb123262d38a675c5151b936566eb7913748130bf612c973b4db5ec151a95718f015c8699ed193e5d223121c9b7e674370db8d57fc5f32f919987b7f5e98206d046c4e642dd6878f772dc4e54fffdd5691742e3bfc0723dbfb8040f5352d38550d7617b57bd32e5a0e51a2c339ad187b0d8604f12c7296faafbbabe10d8e77492af77ab4a0a673cefbcdaebe8debd786d912b08b6939fac615335ee6a9bcf0cee1c6fb37b482df56bb363ac48f16f73b262510f44baa791dac0e6dfe0692ba7851dbe2195185f83d24d51f0e587514d8fee58f6b41b5bd47afd7faaadd23aa009f3f34c1064290847448039061405c54375817ba52899de93334fe4e2d9401f5af4a06c4fea46c1d22784e01862319256ac1241fdd29dc8ec1c1c95c73d7cea9cee4abca75bcbbc6adb4903f60be1af377eb1c8b523159a30d5f3d8a5dcc2c8b8f36f77aff35fe704d133a640372c49444a8136efd9d361797a67ad25b73702223c654a662b2df97fb46002767ea52d7101e39adff0dc2dbdae4a85c374bc4564a2de379363d66c642737b5f6d51f447e2d4184cb0c56536de2dade7fb122976e5984d6a5d2075b90f2fd408ebb3c48f018d34ff2ed903141ecf151e2468f5d15b48e5b11a80443d0a38fa8dd97af0163572064fcd04c836716f4710498dc920fcd18dea7288ecd801a7590e72f37ac48be228ce82c00915e4d03696279bce3776aac5951a2d7719dc0a099dc41094cfaf850af56663700af40d7f7c92c21d5351f7e255236ce6d85c96b03696694347fc18133f4f8d2ef0900adfcb0d76f3f3d58f5751e1b8f20b3b34c67c3d2cd56a02db01508dba64ae5bfb161dfe02bdb9a57e817c4e57e4c8129b4a85db8887d468ad2d8905c8ce6d3585123deb0f39618bd587f173c4884f88e892c2fb72176bc70407457062c5b5d58f7f91090fbc8260c653a026986b60d60499c4485a3c0d76e0307a8e754a1ee17b44e04f7be71a7dd784acc1ae8fb76049e0d654c30d972160106802b862617d82e2443ee2aca14856bba05986ba646047633db8450aec3fac1710493616a4b81e5347ad45123c663ef31b9ca175b2577b80ccc27fd6ec6593057c82449aa6cf103ce84e27c3e79edef2cbcd4ec3991a8d9275a98a6db1158636055ccdf8d46b59f2e8ad46038350a60cd7ecefd9777e22930e3b0e2bb4f30a09c8139ef2f473a38509136ed72fd3e09fb2e5484244c9bfa9f7f89cb020b82517ff3a6055ff674a384e861bca7eb5711fda3b765c16a96b649130c08421e9f432170c1b5c7073fbe8b58ee67ade30702dd3aead0b6ddf56f4129d365fe079e72cc137018321efe730a7bbaf13cd56fd90e5f6fd03e839929b6ce8a89b54350a0a02ec8ebb9c84c949dec5a92adfb816ed96661bb9e71dcd395fe5a13955c2ea1edf03a034ace6655fd8bb14a3132458f51af789d68b2eed613996c78aeeefd4045a48dd58ff412a00ba6938e9dcc87e1ccab967a56dd9bb2dfee350f96aa5d00ab618e982158033446505e319314f1ba0fcc33844de3914fb3e20095f832c741ddb6d5671a9bf43ca2ecb5b28017119c63ea717c8d899309700392f01e9a48f1a21b43560e40046eda36cc45f3ba42cecaaeaa73ed065f7e24938488c0518083d94ccf7aefe46f19f14ccefcdad0de82e8591a4a3c7a108db30c45655a2aa700f3685d2c038fd8252369a6e6966afa09a4124edb1fcaad9d78cb956ad59c865